{
 "format": "spyder-bone/engine_check",
 "format_version": 1,
 "check": "acquisition",
 "id": "check.acquisition",
 "version": "5.0.0",
 "engine_min": "1.0",
 "status": "active",
 "title": "Acquisition checks B1-B8 and the per-sign B6b gates (as-measured scan)",
 "description": "Supported-input matrix (B1: LabSpec as8, Trek-type as7, FieldSpec 3 legacy reflectance; per-file detector joins) and the bad-scan checks on the AS-MEASURED reflectance (PLAN v3.2 Step 1-2). Unusable (B1-B4) replaces every verdict with Rescan. B6 is a Check only, raised per model when noise could carry the reading across a verdict cut (DECISIONS 109); never Unusable. B6b gates each contaminant sign (and C1) on the noise of its own statistic: read as measured, or through a near-uncorrected correction (every statistic the noise policies read keeps its noise within 15% of the uncorrected noise; every noise policy then treats the stream exactly like a native standard-resolution scan), today's standard-resolution table on N2; through any other correction, the statistic's noise SD propagated through that correction against a cut fixed once in SD units (DECISIONS 137). N2 is the canonical noise measure (1e-5 absorbance).",
 "licence": "CC-BY-4.0",
 "created": "2026-10-03",
 "provenance": {
  "basis": "SPYDER Bone planning reports 03 (reader), 07 (warnings), Phase 0a A1-A2 (canonical N2, B6b cut 60, correlated-noise gains). B8 thresholds from the relative splice steps of every file in hand (standard-resolution files <= 1.7%, high-resolution sessions <= 6.8%).",
  "per_sign_gates": "Phase 0c (high-resolution noise study): clean false alarms of each sign on 1,201 clean standard-resolution scans with high-resolution-like noise injected, after the v0.2 transfer, as a function of the noise in the sign's own window; cut = the largest N2 at which the false-alarm rate stays within +0.25 points of the noiseless rate (model noise shape; measured shape as the pessimistic bound): wax 80 / 59 -> 60, ester 306 / 215 -> 250, plaster 174 / 125 -> 150, C1 125 / 50 -> 125. Burnt (visible-range edge and short-wave OH bands) is ungated on v0.2; the uncorrected table keeps the shipped gate so standard-resolution behaviour is unchanged.",
  "any_correction": "DECISIONS 137 (g2, 2026-10-19): each sign statistic is linear in absorbance, so its noise SD per unit of measured N2 comes from any blur + absorbance-gain correction by the engine's own propagation (the method of the band and model noise gains; Monte Carlo through v0.2 agrees within 3%). One rule reproduces both shipped tables: gate when the propagated SD exceeds c_s, c_s = the v0.2 gain x the v0.2 cut (plaster 150, wax 60, ester 250, C1 125 on their windows; fallbacks 30 on N2(1500-1600)). On the high-resolution sets in hand it reproduces every v0.2 gate and fallback exactly; the standard-resolution plaster and C1 cuts are the same rule within 1-2%. Kept for streams read as measured (and near-uncorrected corrections, which every noise policy treats as a native standard-resolution scan; Matt, 2026-10-19: standard-res never changes): the shipped table, exactly (LabSpec 4 standard never changes; unifying it would move ester on ~0.3% of standard-resolution scans).",
  "fallbacks": "2026-10-13 (pre-registered): the gates' cut N2(1500-1600) <= 30 (both fallbacks) is the largest noise at which the reduced statistics keep clean false alarms within the noiseless rate on 1,201 clean standard-resolution scans with high-resolution-like noise injected after the v0.2 transfer; 38 of 40 dark high-resolution scans pass it. Not N2(1400-1500) for plaster: the gypsum bands themselves raise it (median 17 -> 46-81 with plaster added), so that gate would close exactly when plaster is present (amendment 1). Since 5.0.0 (DECISIONS 137) the trigger is the reduced statistic's propagated SD at most c (c = the v0.2 gain x 30), the same cut for any correction."
 },
 "parameters": {
  "input_matrix": {
   "file_magic": [
    "as8",
    "as7",
    "ASD"
   ],
   "data_type_by_magic": {
    "as8": 0,
    "as7": 0,
    "ASD": 1
   },
   "require_dark_corrected_magic": [
    "as8"
   ],
   "grid": {
    "start_nm": 350.0,
    "step_nm": 1.0,
    "n": 2151
   },
   "reference_range_nm": [
    1000,
    2450
   ],
   "join_windows_nm": [
    [
     950.0,
     1050.0
    ],
    [
     1700.0,
     1900.0
    ]
   ],
   "note": "DECISIONS 87-88. as8 (LabSpec 4) and as7 (Trek-type handheld): raw DN + stored white reference; ASD = legacy v1 reflectance (FieldSpec 3 .NNN and its ViewSpec .sco), no raw DN (B2 not assessed). Joins: the header's when each lies in its window, else the largest clear white-reference DN jump in the window, else 1000/1800; a join outside its window is unsupported."
  },
  "integrity_range_nm": [
   1000,
   2450
  ],
  "B2_saturation": {
   "dn_at_least": 65000,
   "note": "raw sample DN in the integrity range"
  },
  "B3_impossible": {
   "r_at_most": 0.0
  },
  "B4_panel_or_empty": {
   "panel_mean_range": [
    0.95,
    1.05
   ],
   "panel_sd_below": 0.03,
   "empty_mean_below": 0.03
  },
  "B5_dark": {
   "mean_R_below": 0.08
  },
  "B6_noise": {
   "cuts": [
    0.5,
    3.0
   ],
   "check_if_cut_within_sd": 2.6,
   "unusable": null,
   "note": "implied SD (% collagen) = gain x N2, the gains computed for the model and the correction applied (noise_gains.json). Check when a verdict cut lies within check_if_cut_within_sd x SD of the reading: 2 SD, with the SD scaled by 1.3 because same-spot repeat scans (62 spots x 3) scatter 1.1-1.4x the implied SD (DECISIONS 109, work/noise_pred/REPORT_noise_pred.md)."
  },
  "B6b_signs_gate": {
   "n2_window_nm": [
    2000,
    2100
   ],
   "signs": [
    "plaster",
    "wax",
    "ester",
    "burnt",
    "C1"
   ],
   "contaminant_signs": [
    "plaster",
    "wax",
    "ester",
    "C1"
   ],
   "uncorrected": {
    "plaster": {
     "n2_window_nm": [
      2000,
      2100
     ],
     "n2_above": 60.0
    },
    "wax": {
     "n2_window_nm": [
      2000,
      2100
     ],
     "n2_above": 60.0
    },
    "ester": {
     "n2_window_nm": [
      2000,
      2100
     ],
     "n2_above": 60.0
    },
    "burnt": {
     "n2_window_nm": [
      2000,
      2100
     ],
     "n2_above": 60.0
    },
    "C1": {
     "n2_window_nm": [
      2000,
      2100
     ],
     "n2_above": 60.0
    }
   },
   "std_like_within": 0.15,
   "corrected": {
    "plaster": {
     "statistic": "plaster_1945",
     "n2_window_nm": [
      2000,
      2100
     ],
     "sd_above": 0.02828399202273366
    },
    "wax": {
     "statistic": "wax_1766",
     "n2_window_nm": [
      1500,
      1600
     ],
     "sd_above": 2.1095118686937884
    },
    "ester": {
     "statistic": "ester_2254",
     "n2_window_nm": [
      2220,
      2245
     ],
     "sd_above": 7.80219477122152
    },
    "burnt": null,
    "C1": {
     "statistic": "c1",
     "n2_window_nm": [
      2000,
      2100
     ],
     "sd_above": 1.8171613293840232
    }
   },
   "fallbacks": {
    "plaster": {
     "variant": "band_1446",
     "statistic": "plaster_1446",
     "n2_window_nm": [
      1500,
      1600
     ],
     "sd_at_most": 0.008695836931998813
    },
    "C1": {
     "variant": "swir1",
     "statistic": "c1_swir1",
     "n2_window_nm": [
      1500,
      1600
     ],
     "sd_at_most": 0.7879697644590612
    }
   },
   "correlation_nm": 1.25,
   "kernels": {
    "signs": {
     "absorbance_clip": 0.001,
     "savgol": {
      "window": 17,
      "polyorder": 2,
      "deriv": 2,
      "delta": 1.0,
      "mode": "interp"
     },
     "scale": -100000.0
    },
    "c1": {
     "absorbance_clip": 1e-06,
     "savgol": {
      "window": 31,
      "polyorder": 3,
      "deriv": 2,
      "delta": 1.0,
      "mode": "interp"
     },
     "scale": -100000.0
    }
   },
   "statistics": {
    "plaster_1945": {
     "kernel": "signs",
     "windows": [
      [
       1942,
       1948,
       0.006050062389121104
      ],
      [
       1930,
       1935,
       -0.003025031194560552
      ],
      [
       1955,
       1960,
       -0.003025031194560552
      ]
     ],
     "of": "check.signs plaster: the 1945 nm band's load (sharp index / plaster contrast)"
    },
    "wax_1766": {
     "kernel": "signs",
     "windows": [
      [
       1763,
       1769,
       1.0
      ],
      [
       1751,
       1757,
       -0.5
      ],
      [
       1775,
       1781,
       -0.5
      ]
     ],
     "of": "check.signs wax: the 1766 nm sharp index"
    },
    "ester_2254": {
     "kernel": "signs",
     "windows": [
      [
       2251,
       2257,
       1.0
      ],
      [
       2239,
       2245,
       -0.5
      ],
      [
       2263,
       2269,
       -0.5
      ]
     ],
     "of": "check.signs ester: the 2254 nm sharp index"
    },
    "c1": {
     "kernel": "c1",
     "windows": [
      [
       1726,
       1730,
       1.0
      ],
      [
       1760,
       1764,
       1.0
      ],
      [
       2260,
       2264,
       1.0
      ],
      [
       2348,
       2352,
       1.0
      ],
      [
       1508,
       1512,
       -0.7237030866308519
      ],
      [
       2042,
       2046,
       -0.7237030866308519
      ],
      [
       2173,
       2177,
       -0.7237030866308519
      ]
     ],
     "of": "check.c1: the C1 excess (C-H band readings minus b x N-H band readings)"
    },
    "plaster_1446": {
     "kernel": "signs",
     "windows": [
      [
       1444,
       1448,
       0.007310342683907804
      ],
      [
       1434,
       1438,
       -0.003655171341953902
      ],
      [
       1454,
       1458,
       -0.003655171341953902
      ]